{
  "schema": "athyper.entity-source/2",
  "entityCode": "country",
  "authoringOwnership": "platform",
  "entityClass": "reference",
  "ownershipModel": "system",
  "targets": {
    "declared": [
      "studio",
      "neon",
      "mesh"
    ],
    "required": [
      "neon",
      "mesh",
      "studio"
    ],
    "recommended": []
  },
  "definition": "definition.json",
  "artifacts": [
    "core.json"
  ],
  "placement": "placement.json",
  "localization": "localization.json",
  "capabilities": "capabilities.json",
  "activity": "activity.json"
}
