{
  "schema": "athyper.entity-source/2",
  "entityCode": "bank_identifier",
  "authoringOwnership": "platform",
  "entityClass": null,
  "ownershipModel": null,
  "targets": {
    "declared": [
      "neon"
    ],
    "required": [
      "neon",
      "mesh",
      "studio"
    ],
    "recommended": []
  },
  "artifacts": [
    "core.json"
  ]
}
